{
  "capabilities": [
    "linguistic.part-of-speech",
    "linguistic.morphology"
  ],
  "dependencies": [
    {
      "assertion": {
        "feature": "sp",
        "node_type": "word",
        "value": "subs",
        "value_semantics": "semantic"
      },
      "component_id": "syriac-tf",
      "dependency_id": "dep:syriac:word-sp:subs",
      "evidence": [
        {
          "content_digest": "sha256:2851e7403ec641ca47f6cd7b2d59f6e58af27f5336f5376b5e6af5a078d0bc3f",
          "evidence_id": "evidence:syriac:word-sp-substantive"
        }
      ],
      "kind": "native-value-present"
    },
    {
      "assertion": {
        "feature": "ls",
        "node_type": "word",
        "value": "prop",
        "value_semantics": "semantic"
      },
      "component_id": "syriac-tf",
      "dependency_id": "dep:syriac:word-ls:prop",
      "evidence": [
        {
          "content_digest": "sha256:e6b84ffceb7e96ce9a277216a279a2446d57fc0852c1f540f5fb338219580c19",
          "evidence_id": "evidence:syriac:word-noun-morphology"
        },
        {
          "content_digest": "sha256:c237ccac53cb3061caca6b3f8d93360ec97a57ed41dab1f73790203c01d31468",
          "evidence_id": "evidence:syriac:proper-inside-subs"
        }
      ],
      "kind": "native-value-present"
    },
    {
      "assertion": {
        "feature": "gn",
        "node_type": "word",
        "value": "m",
        "value_semantics": "semantic"
      },
      "component_id": "syriac-tf",
      "dependency_id": "dep:syriac:word-gn:m",
      "evidence": [
        {
          "content_digest": "sha256:e6b84ffceb7e96ce9a277216a279a2446d57fc0852c1f540f5fb338219580c19",
          "evidence_id": "evidence:syriac:word-noun-morphology"
        }
      ],
      "kind": "native-value-present"
    },
    {
      "assertion": {
        "feature": "gn",
        "node_type": "word",
        "value": "f",
        "value_semantics": "semantic"
      },
      "component_id": "syriac-tf",
      "dependency_id": "dep:syriac:word-gn:f",
      "evidence": [
        {
          "content_digest": "sha256:e6b84ffceb7e96ce9a277216a279a2446d57fc0852c1f540f5fb338219580c19",
          "evidence_id": "evidence:syriac:word-noun-morphology"
        }
      ],
      "kind": "native-value-present"
    },
    {
      "assertion": {
        "feature": "nu",
        "node_type": "word",
        "value": "sg",
        "value_semantics": "semantic"
      },
      "component_id": "syriac-tf",
      "dependency_id": "dep:syriac:word-nu:sg",
      "evidence": [
        {
          "content_digest": "sha256:e6b84ffceb7e96ce9a277216a279a2446d57fc0852c1f540f5fb338219580c19",
          "evidence_id": "evidence:syriac:word-noun-morphology"
        }
      ],
      "kind": "native-value-present"
    },
    {
      "assertion": {
        "feature": "nu",
        "node_type": "word",
        "value": "pl",
        "value_semantics": "semantic"
      },
      "component_id": "syriac-tf",
      "dependency_id": "dep:syriac:word-nu:pl",
      "evidence": [
        {
          "content_digest": "sha256:e6b84ffceb7e96ce9a277216a279a2446d57fc0852c1f540f5fb338219580c19",
          "evidence_id": "evidence:syriac:word-noun-morphology"
        }
      ],
      "kind": "native-value-present"
    },
    {
      "assertion": {
        "feature": "nu",
        "node_type": "word",
        "value": "du",
        "value_semantics": "semantic"
      },
      "component_id": "syriac-tf",
      "dependency_id": "dep:syriac:word-nu:du",
      "evidence": [
        {
          "content_digest": "sha256:e6b84ffceb7e96ce9a277216a279a2446d57fc0852c1f540f5fb338219580c19",
          "evidence_id": "evidence:syriac:word-noun-morphology"
        }
      ],
      "kind": "native-value-present"
    },
    {
      "assertion": {
        "feature": "sp",
        "node_type": "word",
        "value": "verb",
        "value_semantics": "semantic"
      },
      "component_id": "syriac-tf",
      "dependency_id": "dep:syriac:word-sp:verb",
      "evidence": [
        {
          "evidence_id": "evidence:syriac:word-sp-verb-code",
          "content_digest": "sha256:a220f482f37ebca0991cd0c073e7f7199e981f8961c89c9d46738dc1b01a9450"
        }
      ],
      "kind": "native-value-present"
    },
    {
      "assertion": {
        "feature": "sp",
        "node_type": "word",
        "value": "adjv",
        "value_semantics": "semantic"
      },
      "component_id": "syriac-tf",
      "dependency_id": "dep:syriac:word-sp:adjv",
      "evidence": [
        {
          "evidence_id": "evidence:syriac:word-sp-adj-adv-source",
          "content_digest": "sha256:42aaa63ed1049b3f6e8fb77bdc466229d7877e361b0e5843aeff9201882fd649"
        }
      ],
      "kind": "native-value-present"
    },
    {
      "assertion": {
        "feature": "sp",
        "node_type": "word",
        "value": "advb",
        "value_semantics": "semantic"
      },
      "component_id": "syriac-tf",
      "dependency_id": "dep:syriac:word-sp:advb",
      "evidence": [
        {
          "evidence_id": "evidence:syriac:word-sp-adj-adv-source",
          "content_digest": "sha256:42aaa63ed1049b3f6e8fb77bdc466229d7877e361b0e5843aeff9201882fd649"
        }
      ],
      "kind": "native-value-present"
    },
    {
      "dependency_id": "dep:syriac:word-sp:conj",
      "kind": "native-value-present",
      "component_id": "syriac-tf",
      "assertion": {
        "feature": "sp",
        "node_type": "word",
        "value": "conj",
        "value_semantics": "semantic"
      },
      "evidence": [
        {
          "evidence_id": "evidence:syriac:word-sp-batch-i034a",
          "content_digest": "sha256:33c7815d10ece46715e950a94c7d2dbef6265b0d17e70e20571e0b72a82aba38"
        }
      ]
    },
    {
      "dependency_id": "dep:syriac:word-sp:inrg",
      "kind": "native-value-present",
      "component_id": "syriac-tf",
      "assertion": {
        "feature": "sp",
        "node_type": "word",
        "value": "inrg",
        "value_semantics": "semantic"
      },
      "evidence": [
        {
          "evidence_id": "evidence:syriac:word-sp-batch-i034a",
          "content_digest": "sha256:33c7815d10ece46715e950a94c7d2dbef6265b0d17e70e20571e0b72a82aba38"
        }
      ]
    },
    {
      "dependency_id": "dep:syriac:word-sp:intj",
      "kind": "native-value-present",
      "component_id": "syriac-tf",
      "assertion": {
        "feature": "sp",
        "node_type": "word",
        "value": "intj",
        "value_semantics": "semantic"
      },
      "evidence": [
        {
          "evidence_id": "evidence:syriac:word-sp-batch-i034a",
          "content_digest": "sha256:33c7815d10ece46715e950a94c7d2dbef6265b0d17e70e20571e0b72a82aba38"
        }
      ]
    },
    {
      "dependency_id": "dep:syriac:word-sp:nega",
      "kind": "native-value-present",
      "component_id": "syriac-tf",
      "assertion": {
        "feature": "sp",
        "node_type": "word",
        "value": "nega",
        "value_semantics": "semantic"
      },
      "evidence": [
        {
          "evidence_id": "evidence:syriac:word-sp-batch-i034a",
          "content_digest": "sha256:33c7815d10ece46715e950a94c7d2dbef6265b0d17e70e20571e0b72a82aba38"
        }
      ]
    },
    {
      "dependency_id": "dep:syriac:word-sp:prep",
      "kind": "native-value-present",
      "component_id": "syriac-tf",
      "assertion": {
        "feature": "sp",
        "node_type": "word",
        "value": "prep",
        "value_semantics": "semantic"
      },
      "evidence": [
        {
          "evidence_id": "evidence:syriac:word-sp-batch-i034a",
          "content_digest": "sha256:33c7815d10ece46715e950a94c7d2dbef6265b0d17e70e20571e0b72a82aba38"
        }
      ]
    },
    {
      "dependency_id": "dep:syriac:word-sp:pron",
      "kind": "native-value-present",
      "component_id": "syriac-tf",
      "assertion": {
        "feature": "sp",
        "node_type": "word",
        "value": "pron",
        "value_semantics": "semantic"
      },
      "evidence": [
        {
          "evidence_id": "evidence:syriac:word-sp-batch-i034a",
          "content_digest": "sha256:33c7815d10ece46715e950a94c7d2dbef6265b0d17e70e20571e0b72a82aba38"
        }
      ]
    }
  ],
  "dependency_contract_version": 1,
  "license": "MIT",
  "mapping_sources": [
    "mappings/noun.json",
    "mappings/noun-morphology.json",
    "mappings/verb.json",
    "mappings/adj-adv.json",
    "mappings/olia-pos.json"
  ],
  "minimum_tfont_runtime": "0.1.0",
  "ontology_locks": [
    "olia-reference-model",
    "olia-reference-model-i034a-pos"
  ],
  "parent_compatibility": "exact-only",
  "parent_component_manifest": "parent/expected-components.json",
  "profile_catalog_version": 1,
  "profile_id": "tfont-syriac",
  "profile_version": "0.5.0",
  "profiles": [
    "linguistic"
  ],
  "required_components": [
    "syriac-tf"
  ],
  "schema_version": 2,
  "semantic_domains": [
    "linguistic"
  ]
}
