{
  "capabilities": [
    "linguistic.part-of-speech",
    "linguistic.morphology"
  ],
  "dependencies": [
    {
      "assertion": {
        "feature": "sp",
        "node_type": "word",
        "value": "subs",
        "value_semantics": "semantic"
      },
      "component_id": "syriac-tf",
      "dependency_id": "dep:syriac:word-sp:subs",
      "evidence": [
        {
          "content_digest": "sha256:2851e7403ec641ca47f6cd7b2d59f6e58af27f5336f5376b5e6af5a078d0bc3f",
          "evidence_id": "evidence:syriac:word-sp-substantive"
        }
      ],
      "kind": "native-value-present"
    },
    {
      "assertion": {
        "feature": "ls",
        "node_type": "word",
        "value": "prop",
        "value_semantics": "semantic"
      },
      "component_id": "syriac-tf",
      "dependency_id": "dep:syriac:word-ls:prop",
      "evidence": [
        {
          "content_digest": "sha256:e6b84ffceb7e96ce9a277216a279a2446d57fc0852c1f540f5fb338219580c19",
          "evidence_id": "evidence:syriac:word-noun-morphology"
        },
        {
          "content_digest": "sha256:c237ccac53cb3061caca6b3f8d93360ec97a57ed41dab1f73790203c01d31468",
          "evidence_id": "evidence:syriac:proper-inside-subs"
        }
      ],
      "kind": "native-value-present"
    },
    {
      "assertion": {
        "feature": "gn",
        "node_type": "word",
        "value": "m",
        "value_semantics": "semantic"
      },
      "component_id": "syriac-tf",
      "dependency_id": "dep:syriac:word-gn:m",
      "evidence": [
        {
          "content_digest": "sha256:e6b84ffceb7e96ce9a277216a279a2446d57fc0852c1f540f5fb338219580c19",
          "evidence_id": "evidence:syriac:word-noun-morphology"
        }
      ],
      "kind": "native-value-present"
    },
    {
      "assertion": {
        "feature": "gn",
        "node_type": "word",
        "value": "f",
        "value_semantics": "semantic"
      },
      "component_id": "syriac-tf",
      "dependency_id": "dep:syriac:word-gn:f",
      "evidence": [
        {
          "content_digest": "sha256:e6b84ffceb7e96ce9a277216a279a2446d57fc0852c1f540f5fb338219580c19",
          "evidence_id": "evidence:syriac:word-noun-morphology"
        }
      ],
      "kind": "native-value-present"
    },
    {
      "assertion": {
        "feature": "nu",
        "node_type": "word",
        "value": "sg",
        "value_semantics": "semantic"
      },
      "component_id": "syriac-tf",
      "dependency_id": "dep:syriac:word-nu:sg",
      "evidence": [
        {
          "content_digest": "sha256:e6b84ffceb7e96ce9a277216a279a2446d57fc0852c1f540f5fb338219580c19",
          "evidence_id": "evidence:syriac:word-noun-morphology"
        }
      ],
      "kind": "native-value-present"
    },
    {
      "assertion": {
        "feature": "nu",
        "node_type": "word",
        "value": "pl",
        "value_semantics": "semantic"
      },
      "component_id": "syriac-tf",
      "dependency_id": "dep:syriac:word-nu:pl",
      "evidence": [
        {
          "content_digest": "sha256:e6b84ffceb7e96ce9a277216a279a2446d57fc0852c1f540f5fb338219580c19",
          "evidence_id": "evidence:syriac:word-noun-morphology"
        }
      ],
      "kind": "native-value-present"
    },
    {
      "assertion": {
        "feature": "nu",
        "node_type": "word",
        "value": "du",
        "value_semantics": "semantic"
      },
      "component_id": "syriac-tf",
      "dependency_id": "dep:syriac:word-nu:du",
      "evidence": [
        {
          "content_digest": "sha256:e6b84ffceb7e96ce9a277216a279a2446d57fc0852c1f540f5fb338219580c19",
          "evidence_id": "evidence:syriac:word-noun-morphology"
        }
      ],
      "kind": "native-value-present"
    }
  ],
  "dependency_contract_version": 1,
  "license": "MIT",
  "mapping_sources": [
    "mappings/noun.json",
    "mappings/noun-morphology.json"
  ],
  "minimum_tfont_runtime": "0.1.0",
  "ontology_locks": [
    "olia-reference-model"
  ],
  "parent_compatibility": "exact-only",
  "parent_component_manifest": "parent/expected-components.json",
  "profile_catalog_version": 1,
  "profile_id": "tfont-syriac",
  "profile_version": "0.2.0",
  "profiles": [
    "linguistic"
  ],
  "required_components": [
    "syriac-tf"
  ],
  "schema_version": 2,
  "semantic_domains": [
    "linguistic"
  ]
}
