{
  "capabilities": [
    "linguistic.part-of-speech",
    "linguistic.morphology"
  ],
  "dependencies": [
    {
      "assertion": {
        "feature": "sp",
        "node_type": "word",
        "value": "nmpr",
        "value_semantics": "semantic"
      },
      "component_id": "extrabiblical-tf",
      "dependency_id": "dep:extrabiblical:word-sp:nmpr",
      "evidence": [
        {
          "content_digest": "sha256:d198fcc626a60fadecb7b6f167bcf9be728949732e99e660d32b1c7ee3b52a24",
          "evidence_id": "evidence:extrabiblical:word-sp-enum"
        },
        {
          "content_digest": "sha256:68b0bf2c062ff9a4d441cad4ec036c1b0589f6fd439a227838770953a34802c0",
          "evidence_id": "evidence:extrabiblical:feature-authority"
        },
        {
          "content_digest": "sha256:652e3d7bf24022db27d6b9659c079d151ce0ddc86d3cdc30a8a6e962d684bd17",
          "evidence_id": "evidence:bhsa:word-sp-noun-codes"
        }
      ],
      "kind": "native-value-present"
    },
    {
      "assertion": {
        "feature": "sp",
        "node_type": "word",
        "value": "subs",
        "value_semantics": "semantic"
      },
      "component_id": "extrabiblical-tf",
      "dependency_id": "dep:extrabiblical:word-sp:subs",
      "evidence": [
        {
          "content_digest": "sha256:d198fcc626a60fadecb7b6f167bcf9be728949732e99e660d32b1c7ee3b52a24",
          "evidence_id": "evidence:extrabiblical:word-sp-enum"
        },
        {
          "content_digest": "sha256:68b0bf2c062ff9a4d441cad4ec036c1b0589f6fd439a227838770953a34802c0",
          "evidence_id": "evidence:extrabiblical:feature-authority"
        },
        {
          "content_digest": "sha256:652e3d7bf24022db27d6b9659c079d151ce0ddc86d3cdc30a8a6e962d684bd17",
          "evidence_id": "evidence:bhsa:word-sp-noun-codes"
        }
      ],
      "kind": "native-value-present"
    },
    {
      "assertion": {
        "feature": "gn",
        "node_type": "word",
        "value": "m",
        "value_semantics": "semantic"
      },
      "component_id": "extrabiblical-tf",
      "dependency_id": "dep:extrabiblical:word-gn:m",
      "evidence": [
        {
          "content_digest": "sha256:119571ea2a08e31c3ed910879264c3ab484979c5be40e2c87df6fe6699bb36c7",
          "evidence_id": "evidence:extrabiblical:word-gn-observed"
        },
        {
          "content_digest": "sha256:68b0bf2c062ff9a4d441cad4ec036c1b0589f6fd439a227838770953a34802c0",
          "evidence_id": "evidence:extrabiblical:feature-authority"
        },
        {
          "content_digest": "sha256:1391f2b24e36445a65f430c5d372d156810a8d02702f9202022b06583fce962b",
          "evidence_id": "evidence:bhsa:word-gn-values"
        }
      ],
      "kind": "native-value-present"
    },
    {
      "assertion": {
        "feature": "gn",
        "node_type": "word",
        "value": "f",
        "value_semantics": "semantic"
      },
      "component_id": "extrabiblical-tf",
      "dependency_id": "dep:extrabiblical:word-gn:f",
      "evidence": [
        {
          "content_digest": "sha256:119571ea2a08e31c3ed910879264c3ab484979c5be40e2c87df6fe6699bb36c7",
          "evidence_id": "evidence:extrabiblical:word-gn-observed"
        },
        {
          "content_digest": "sha256:68b0bf2c062ff9a4d441cad4ec036c1b0589f6fd439a227838770953a34802c0",
          "evidence_id": "evidence:extrabiblical:feature-authority"
        },
        {
          "content_digest": "sha256:1391f2b24e36445a65f430c5d372d156810a8d02702f9202022b06583fce962b",
          "evidence_id": "evidence:bhsa:word-gn-values"
        }
      ],
      "kind": "native-value-present"
    },
    {
      "assertion": {
        "feature": "nu",
        "node_type": "word",
        "value": "sg",
        "value_semantics": "semantic"
      },
      "component_id": "extrabiblical-tf",
      "dependency_id": "dep:extrabiblical:word-nu:sg",
      "evidence": [
        {
          "content_digest": "sha256:a1cd78766e4f7d5ee7fffe1e59419ff7814461c033d2cc31a1c0f43ca4faaab3",
          "evidence_id": "evidence:extrabiblical:word-nu-observed"
        },
        {
          "content_digest": "sha256:68b0bf2c062ff9a4d441cad4ec036c1b0589f6fd439a227838770953a34802c0",
          "evidence_id": "evidence:extrabiblical:feature-authority"
        },
        {
          "content_digest": "sha256:fce46fa701129f0f9933c9238e4e0fa86e9c1dedafb71c954d0b869aec2014bd",
          "evidence_id": "evidence:bhsa:word-nu-values"
        }
      ],
      "kind": "native-value-present"
    },
    {
      "assertion": {
        "feature": "nu",
        "node_type": "word",
        "value": "pl",
        "value_semantics": "semantic"
      },
      "component_id": "extrabiblical-tf",
      "dependency_id": "dep:extrabiblical:word-nu:pl",
      "evidence": [
        {
          "content_digest": "sha256:a1cd78766e4f7d5ee7fffe1e59419ff7814461c033d2cc31a1c0f43ca4faaab3",
          "evidence_id": "evidence:extrabiblical:word-nu-observed"
        },
        {
          "content_digest": "sha256:68b0bf2c062ff9a4d441cad4ec036c1b0589f6fd439a227838770953a34802c0",
          "evidence_id": "evidence:extrabiblical:feature-authority"
        },
        {
          "content_digest": "sha256:fce46fa701129f0f9933c9238e4e0fa86e9c1dedafb71c954d0b869aec2014bd",
          "evidence_id": "evidence:bhsa:word-nu-values"
        }
      ],
      "kind": "native-value-present"
    },
    {
      "assertion": {
        "feature": "nu",
        "node_type": "word",
        "value": "du",
        "value_semantics": "semantic"
      },
      "component_id": "extrabiblical-tf",
      "dependency_id": "dep:extrabiblical:word-nu:du",
      "evidence": [
        {
          "content_digest": "sha256:a1cd78766e4f7d5ee7fffe1e59419ff7814461c033d2cc31a1c0f43ca4faaab3",
          "evidence_id": "evidence:extrabiblical:word-nu-observed"
        },
        {
          "content_digest": "sha256:68b0bf2c062ff9a4d441cad4ec036c1b0589f6fd439a227838770953a34802c0",
          "evidence_id": "evidence:extrabiblical:feature-authority"
        },
        {
          "content_digest": "sha256:fce46fa701129f0f9933c9238e4e0fa86e9c1dedafb71c954d0b869aec2014bd",
          "evidence_id": "evidence:bhsa:word-nu-values"
        }
      ],
      "kind": "native-value-present"
    },
    {
      "assertion": {
        "feature": "sp",
        "node_type": "word",
        "value": "verb",
        "value_semantics": "semantic"
      },
      "component_id": "extrabiblical-tf",
      "dependency_id": "dep:extrabiblical:word-sp:verb",
      "evidence": [
        {
          "evidence_id": "evidence:extrabiblical:word-sp-verb-source",
          "content_digest": "sha256:c4a1b0e8b81f3764dbc8350d3c10a214844df0cd5599e4ad78cfc01601cdc0d4"
        }
      ],
      "kind": "native-value-present"
    }
  ],
  "dependency_contract_version": 1,
  "license": "MIT",
  "mapping_sources": [
    "mappings/noun.json",
    "mappings/noun-morphology.json",
    "mappings/verb.json"
  ],
  "minimum_tfont_runtime": "0.1.0",
  "ontology_locks": [
    "olia-reference-model"
  ],
  "parent_compatibility": "exact-only",
  "parent_component_manifest": "parent/expected-components.json",
  "profile_catalog_version": 1,
  "profile_id": "tfont-extrabiblical",
  "profile_version": "0.3.0",
  "profiles": [
    "linguistic"
  ],
  "required_components": [
    "extrabiblical-tf"
  ],
  "schema_version": 2,
  "semantic_domains": [
    "linguistic"
  ]
}
